{"bindings":[{"digest":"sha256:09519fbb5580f7a4d9709b4e5ad4ee238549352034fd939b9ed0e9df84f20999","kind":"json","role":"corpus","schemaVersion":"rag-corpus-snapshot-manifest/v2","sizeBytes":375,"slotId":"corpus"}],"cellId":"sha256:1e1eca5480960c23057066358540f27649557fe0b234c46d9f210c68aee01b76","dataset":{"manifestDigest":"sha256:046253960cb5c91733978406ae365417d83192036635b5d75bfa3b8221fa43c0","relevanceTarget":"unit","split":"smoke","status":"candidate"},"factors":[],"measures":[{"config":{},"name":"rag.mrr","required":true,"unit":"ratio","valueKind":"number","version":"v1"}],"pipeline":{"inputs":[{"artifactRole":"corpus","bindingMode":"artifact","id":"corpus","kind":"corpus","manifestSchema":"rag-corpus-snapshot-manifest/v2"},{"bindingMode":"request","id":"query","kind":"query"}],"nodes":[{"config":{},"id":"n-6761d69ad948a76579b7","inputs":[{"from":{"nodeId":"corpus","port":"out"},"port":"corpus"}],"operator":{"kind":"units.identity","version":"v1"}},{"config":{"atomic":null,"levels":null,"overlap":0,"size":200,"unicodePolicy":"utf8-boundary"},"id":"n-f2942207da28e5a92a63","inputs":[{"from":{"nodeId":"n-6761d69ad948a76579b7","port":"units"},"port":"units"}],"operator":{"kind":"chunks.recursive","version":"v1"}},{"config":{"model":"fixture-summary-v1","name":"summary","outputSchema":"transcript-rag-summary/v1","prompt":"fixture-transcript-summary-v1"},"id":"n-a6602cbf238f4b711497","inputs":[{"from":{"nodeId":"n-f2942207da28e5a92a63","port":"chunks"},"port":"chunks"}],"operator":{"kind":"representations.structured-summary","version":"v1"}},{"config":{"batchSize":8,"dimensions":32,"distance":"cosine","model":"fixture-hash-32-v1","normalize":"l2"},"id":"n-15a54b8957f533124eaa","inputs":[{"from":{"nodeId":"n-a6602cbf238f4b711497","port":"representations"},"port":"representations"}],"operator":{"kind":"embed.model","version":"v1"}},{"config":{"lexical":true,"vector":{"distance":"cosine"}},"id":"n-4d450cd81cbc8e4ea550","inputs":[{"from":{"nodeId":"n-15a54b8957f533124eaa","port":"embeddings"},"port":"embeddings"},{"from":{"nodeId":"n-a6602cbf238f4b711497","port":"representations"},"port":"representations.all"}],"operator":{"kind":"index.bleve-multi","version":"v1"}},{"config":{"filter":{},"index":"representations","representation":"summary","topK":10},"id":"n-1dffcb1eb4a0a2a21716","inputs":[{"from":{"nodeId":"n-4d450cd81cbc8e4ea550","port":"index"},"port":"index"},{"from":{"nodeId":"query","port":"out"},"port":"query"}],"operator":{"kind":"retrieve.vector","version":"v1"},"order":1},{"config":{"representative":"scoreThenRepresentationId","scope":"unit"},"id":"n-565abde77787cca782e4","inputs":[{"from":{"nodeId":"n-1dffcb1eb4a0a2a21716","port":"hits"},"port":"hits"}],"operator":{"kind":"collapse.parent","version":"v1"},"order":1},{"config":{"filter":{},"index":"representations","representation":"summary","topK":10},"id":"n-d22d12a300457491462f","inputs":[{"from":{"nodeId":"n-4d450cd81cbc8e4ea550","port":"index"},"port":"index"},{"from":{"nodeId":"query","port":"out"},"port":"query"}],"operator":{"kind":"retrieve.bm25","version":"v1"}},{"config":{"representative":"scoreThenRepresentationId","scope":"unit"},"id":"n-ed602122f4838fc7f84a","inputs":[{"from":{"nodeId":"n-d22d12a300457491462f","port":"hits"},"port":"hits"}],"operator":{"kind":"collapse.parent","version":"v1"}},{"config":{"rankConstant":60,"weights":{}},"id":"n-331f7f5087a9f640f144","inputs":[{"from":{"nodeId":"n-ed602122f4838fc7f84a","port":"parents"},"port":"channel.raw.lexical"},{"from":{"nodeId":"n-565abde77787cca782e4","port":"parents"},"port":"channel.raw.vector"}],"operator":{"kind":"fusion.weighted-rrf","version":"v1"}},{"config":{"representative":"bestFusionContributionThenId","scope":"unit"},"id":"n-4d1e1b680445c15478f5","inputs":[{"from":{"nodeId":"n-331f7f5087a9f640f144","port":"parents"},"port":"parents"}],"operator":{"kind":"collapse.final","version":"v1"}},{"config":{"allSupportingChunks":false,"policy":"bestContributionThenId","results":5},"id":"n-4b3ca9ba363317ddd837","inputs":[{"from":{"nodeId":"n-f2942207da28e5a92a63","port":"chunks"},"port":"chunks"},{"from":{"nodeId":"n-4d1e1b680445c15478f5","port":"parents"},"port":"parents"}],"operator":{"kind":"hydrate.source-evidence","version":"v1"}},{"config":{"candidateCount":20,"inputTemplate":"query-document","model":"fixture-rerank-v1","results":5,"timeoutMilliseconds":5000,"tokenization":"fixture-utf16","truncation":"none"},"id":"n-0fcce3887c9182ab2ecc","inputs":[{"from":{"nodeId":"n-4b3ca9ba363317ddd837","port":"evidence"},"port":"evidence"}],"operator":{"kind":"rerank.cross-encoder","version":"v1"}},{"config":{"citationFailurePolicy":"abstain","citations":"required","contextBudgetTokens":2048,"model":"fixture-summary-v1","prompt":"fixture-answer-v1"},"id":"n-eabff0036d4aa581635a","inputs":[{"from":{"nodeId":"n-0fcce3887c9182ab2ecc","port":"evidence"},"port":"evidence"}],"operator":{"kind":"generate.answer","version":"v1"}}],"outputs":[{"from":{"nodeId":"n-0fcce3887c9182ab2ecc","port":"evidence"},"kind":"evidence","name":"result"}],"schemaVersion":"rag-pipeline-ir/v2"},"schemaVersion":"rag-pipeline-execution/v2","variantId":"fixture"}
