{
	"bindings": [
		{
			"digest": "sha256:09519fbb5580f7a4d9709b4e5ad4ee238549352034fd939b9ed0e9df84f20999",
			"kind": "json",
			"role": "corpus",
			"schemaVersion": "rag-corpus-snapshot-manifest/v2",
			"sizeBytes": 375,
			"slotId": "corpus"
		}
	],
	"cellId": "sha256:f316930628ef5bdc2e9fabccd11c428f4582814a9c3626244d58606b9632d9c8",
	"dataset": {
		"manifestDigest": "sha256:046253960cb5c91733978406ae365417d83192036635b5d75bfa3b8221fa43c0",
		"relevanceTarget": "unit",
		"split": "smoke",
		"status": "candidate"
	},
	"factors": [],
	"measures": [
		{
			"config": {},
			"name": "rag.mrr",
			"required": true,
			"unit": "ratio",
			"valueKind": "number",
			"version": "v1"
		}
	],
	"pipeline": {
		"inputs": [
			{
				"artifactRole": "corpus",
				"bindingMode": "artifact",
				"id": "corpus",
				"kind": "corpus",
				"manifestSchema": "rag-corpus-snapshot-manifest/v2"
			},
			{ "bindingMode": "request", "id": "query", "kind": "query" }
		],
		"nodes": [
			{
				"config": {},
				"id": "n-6761d69ad948a76579b7",
				"inputs": [{ "from": { "nodeId": "corpus", "port": "out" }, "port": "corpus" }],
				"operator": { "kind": "units.identity", "version": "v1" }
			},
			{
				"config": {
					"atomic": null,
					"levels": null,
					"overlap": 0,
					"size": 200,
					"unicodePolicy": "utf8-boundary"
				},
				"id": "n-f2942207da28e5a92a63",
				"inputs": [
					{ "from": { "nodeId": "n-6761d69ad948a76579b7", "port": "units" }, "port": "units" }
				],
				"operator": { "kind": "chunks.recursive", "version": "v1" }
			},
			{
				"config": { "name": "raw" },
				"id": "n-2f57738ba834d65776b4",
				"inputs": [
					{ "from": { "nodeId": "n-f2942207da28e5a92a63", "port": "chunks" }, "port": "chunks" }
				],
				"operator": { "kind": "representations.raw", "version": "v1" }
			},
			{
				"config": {
					"batchSize": 4,
					"dimensions": 8,
					"distance": "cosine",
					"model": "fixture-embedding-v1",
					"normalize": "l2"
				},
				"id": "n-28fc10f29be22a46a618",
				"inputs": [
					{
						"from": { "nodeId": "n-2f57738ba834d65776b4", "port": "representations" },
						"port": "representations"
					}
				],
				"operator": { "kind": "embed.model", "version": "v1" }
			},
			{
				"config": { "lexical": true, "vector": { "distance": "cosine" } },
				"id": "n-eaaf0a8bf45828c82c65",
				"inputs": [
					{
						"from": { "nodeId": "n-28fc10f29be22a46a618", "port": "embeddings" },
						"port": "embeddings"
					},
					{
						"from": { "nodeId": "n-2f57738ba834d65776b4", "port": "representations" },
						"port": "representations.all"
					}
				],
				"operator": { "kind": "index.bleve-multi", "version": "v1" }
			},
			{
				"config": { "filter": {}, "index": "representations", "representation": "raw", "topK": 10 },
				"id": "n-7acdae483e8187d9e0fe",
				"inputs": [
					{ "from": { "nodeId": "n-eaaf0a8bf45828c82c65", "port": "index" }, "port": "index" },
					{ "from": { "nodeId": "query", "port": "out" }, "port": "query" }
				],
				"operator": { "kind": "retrieve.bm25", "version": "v1" }
			},
			{
				"config": { "filter": {}, "index": "representations", "representation": "raw", "topK": 10 },
				"id": "n-98e78dd9f373a838ad2a",
				"inputs": [
					{ "from": { "nodeId": "n-eaaf0a8bf45828c82c65", "port": "index" }, "port": "index" },
					{ "from": { "nodeId": "query", "port": "out" }, "port": "query" }
				],
				"operator": { "kind": "retrieve.vector", "version": "v1" },
				"order": 1
			},
			{
				"config": { "representative": "scoreThenRepresentationId", "scope": "unit" },
				"id": "n-a93ed8645a6619e3abe2",
				"inputs": [
					{ "from": { "nodeId": "n-7acdae483e8187d9e0fe", "port": "hits" }, "port": "hits" }
				],
				"operator": { "kind": "collapse.parent", "version": "v1" }
			},
			{
				"config": { "representative": "scoreThenRepresentationId", "scope": "unit" },
				"id": "n-e79deae07b00c4441feb",
				"inputs": [
					{ "from": { "nodeId": "n-98e78dd9f373a838ad2a", "port": "hits" }, "port": "hits" }
				],
				"operator": { "kind": "collapse.parent", "version": "v1" },
				"order": 1
			},
			{
				"config": { "rankConstant": 60, "weights": {} },
				"id": "n-e2e1b553a7f42e3c8171",
				"inputs": [
					{
						"from": { "nodeId": "n-a93ed8645a6619e3abe2", "port": "parents" },
						"port": "channel.raw.lexical"
					},
					{
						"from": { "nodeId": "n-e79deae07b00c4441feb", "port": "parents" },
						"port": "channel.raw.vector"
					}
				],
				"operator": { "kind": "fusion.weighted-rrf", "version": "v1" }
			},
			{
				"config": { "representative": "bestFusionContributionThenId", "scope": "unit" },
				"id": "n-4f5edef920782b85a418",
				"inputs": [
					{ "from": { "nodeId": "n-e2e1b553a7f42e3c8171", "port": "parents" }, "port": "parents" }
				],
				"operator": { "kind": "collapse.final", "version": "v1" }
			},
			{
				"config": {
					"allSupportingChunks": false,
					"policy": "bestContributionThenId",
					"results": 5
				},
				"id": "n-5de237ccc1fdf4882daf",
				"inputs": [
					{ "from": { "nodeId": "n-f2942207da28e5a92a63", "port": "chunks" }, "port": "chunks" },
					{ "from": { "nodeId": "n-4f5edef920782b85a418", "port": "parents" }, "port": "parents" }
				],
				"operator": { "kind": "hydrate.source-evidence", "version": "v1" }
			}
		],
		"outputs": [
			{
				"from": { "nodeId": "n-5de237ccc1fdf4882daf", "port": "evidence" },
				"kind": "evidence",
				"name": "result"
			}
		],
		"schemaVersion": "rag-pipeline-ir/v2"
	},
	"schemaVersion": "rag-pipeline-execution/v2",
	"variantId": "fixture"
}
